{"profile":"vusl.mapping-review.v0.1","source":{"system":"sample-a","scope":"test","contract":"fixture.tool","contract_version":"1","native_id":"tool-1","revision":"r1"},"target":{"system":"sample-b","scope":"test","contract":"fixture.tool","contract_version":"2","native_id":"tool-9","revision":"r2"},"facets":[{"source_term":"action","target_term":"operation","required":true,"fidelity":"preserved","loss":null,"note":"Selected action meaning retained.","evidence":[{"system":"sample-a","scope":"test","contract":"fixture.review","contract_version":"1","native_id":"review-1","revision":"r1"}]},{"source_term":"matrix","target_term":"mapped","required":false,"fidelity":"unknown","loss":null,"note":"Matrix assessment.","evidence":[{"system":"sample-a","scope":"test","contract":"fixture.review","contract_version":"1","native_id":"review-1","revision":"r1"}]}],"relationship":{"state":"evidenced","basis":"producer_statement","evidence":[],"uncertainty":["Residual qualification."]}}