{"profile":"vusl.mapping-review.v0.1","source":{"system":"sample-a","scope":"test","contract":"fixture.tool","contract_version":"1","native_id":"tool-1","revision":"r1"},"target":{"system":"sample-b","scope":"test","contract":"fixture.tool","contract_version":"2","native_id":"tool-9","revision":"r2"},"facets":[{"source_term":"matrix","target_term":null,"required":true,"fidelity":"unsupported","loss":"approximation","note":"Matrix assessment.","evidence":[]}],"relationship":{"state":"evidenced","basis":"none","evidence":[],"uncertainty":["Residual qualification."]}}