{"facets":[{"evidence":[{"contract":"fixture.review","contract_version":"1","native_id":"review-1","revision":"r1","scope":"test","system":"sample-a"}],"fidelity":"preserved","loss":null,"note":"Selected action meaning retained.","required":true,"source_term":"action","target_term":"operation"},{"evidence":[],"fidelity":"unknown","loss":null,"note":"Matrix assessment.","required":false,"source_term":"matrix","target_term":"mapped"}],"profile":"vusl.mapping-review.v0.1","relationship":{"basis":"content_review","evidence":[{"contract":"fixture.review","contract_version":"1","native_id":"review-2","revision":"r1","scope":"test","system":"sample-a"}],"state":"unresolved","uncertainty":["Residual qualification."]},"source":{"contract":"fixture.tool","contract_version":"1","native_id":"tool-1","revision":"r1","scope":"test","system":"sample-a"},"target":{"contract":"fixture.tool","contract_version":"2","native_id":"tool-9","revision":"r2","scope":"test","system":"sample-b"}}